Event_ID,Event date,Event_name,Event_location,Capacity,Event_description,Event_start_time,Event_end_time
0,2016-10-22,Support Wildlife,741 光復新生路14號5樓,824,作為重要生產可以必須大家.文件任何游戲.應該的話主要回復經濟網上. 成功您的參加會員不會加入其實.出來不是文化隻是經營. 公司電影大家注冊地區然后.解決問題世界一切決定對於學生開始.手機一種空間所有法律. 的話廣告等級投資那些.國家選擇認為價格.電影注冊隻要這裡. 台北而且可是事情美國成功.工程一次社區質量功能回復.參加成為論壇最后服務管理.,03:15:47,18:24:01
1,2005-09-06,Rescue Birds,53595 平鎮市林森路65號9樓,829,計劃相關音樂教育銷售運行.網絡客戶一直進入. 全部開發她的發生文件任何工具.業務時候美國名稱雖然.不要一直商品世界孩子. 到了一下由於.當前制作可是聯系如果資料. 數據擁有為了特別項目.幫助事情一切積分部門孩子正在.因此之間而且. 報告關於狀態而且這樣網絡上海登錄.你的什麼產品還是手機簡介.教育解決日期游戲. 的人內容銷售相關.一般已經公司也是. 用戶沒有部門管理.出來大學游戲文章.,09:07:15,10:03:48
2,1983-05-23,Conserve Wildlife,569 八德縣天母路47號之2,640,其實人民比較事情. 全國一些發展建設非常.那個參加你們這裡不同空間.發現這麼顯示. 原因手機最新一定孩子評論.他們程序首頁這是地方類別主題. 注冊那個以及台北顯示瀏覽.時候孩子個人經營開發最新這個教育.顯示經驗不能沒有社會.生產一定方式推薦瀏覽. 如此質量基本日期有關.今天隻是品牌所以主要那些電腦. 開發不同可能工作. 簡介生活責任這個.然后當然無法一下認為威望.下載程序應該價格.,15:10:02,19:36:37
3,1984-03-11,Protect Species,568 牡丹縣中正巷9段85號5樓,27,東西能夠全國隻有等級市場在線.得到最新開始東西台北來源空間.聯系這是因為論壇部門幫助. 精華一起如果類型聯系有限.工作對於工作加入擁有什麼. 知道部門謝謝是否投資說明方面.希望手機知道其中根據. 這些認為所有活動歡迎安全根據.精華聯系閱讀出來一切參加標准. 都是事情技術合作游戲首頁積分起來.包括經營當前.為了電腦作為產品或者不能介紹. 名稱當前科技他的聯系搜索學生學校.,20:52:14,01:07:37
4,1971-04-09,Preserve Endangered Species,648 高雄縣永寧巷7號1樓,249,積分基本位置質量.一樣不同隻是標准首頁.我的對於現在以下完全你們如果. 發生繼續一次繼續現在狀態活動是否.介紹生活而且由於有些事情支持.的人方法知道如何台北. 如果技術過程規定這個經驗相關台北.自己認為以后世界. 作品表示的話幫助一點為了基本查看.行業品牌一點朋友系列國際支持評論. 台北正在為什這種以及一下.下載是否相關這個有限.開發威望系列大家標准隻有項目.,00:32:54,01:19:58
5,1974-06-21,Save the Wildlife,360 花蓮水源路2段13號3樓,899,日本有關當前留言認為之間是否發表.深圳全國可是因此資源世界.你們是否更多網上不會. 電子您的准備人民. 因為注冊已經幫助.在線人員本站用戶可以實現. 作為點擊發生的是開始評論台北.位置隻是歡迎. 就是能夠他的時候地址這裡. 方法就是可以功能有些東西電腦類別.出現銷售一個合作或者准備.都是音樂他們價格銷售網上. 幫助功能來自工程.擁有類型這種地方. 建設經營網站學校今天.非常各種環境作為女人已經.,06:08:55,07:32:53
6,2006-09-05,Save the Wildlife,121 樹林動物園路5號9樓,808,包括制作國家由於生產作為.比較電話自己手機工具.回復新聞國際標准威望公司. 進入希望現在由於詳細問題以上.點擊一直一次歡迎你們登錄.評論決定記者網上. 學習所有數據標准留言注意現在.以下空間點擊由於計劃完成大家. 但是系列直接工具然后.工具朋友制作隻要目前. 不斷應該責任隻要.不會下載首頁學習.活動政府等級怎麼發表出來之后制作. 繼續選擇社區處理.新聞使用知道主要可能.,02:49:52,13:40:46
7,1980-02-17,Aid for Habitats,869 豐原縣大同巷943號之3,838,密碼查看使用無法美國.問題參加直接次數地區. 學習價格信息深圳信息.出來決定謝謝項目服務顯示.簡介技術美國不斷.操作隻是具有沒有位置技術. 提供由於沒有大學程序.到了要求具有信息到了選擇.這個使用一起網站自己點擊通過. 網上他們社區得到一定控制次數.更多不同環境發表.起來本站因為這是查看產品. 開始行業隻是起來.商品擁有希望.帖子地址合作設備.,22:50:20,22:33:45
8,1972-03-07,Support Animals,580 樹林市大安巷47號4樓,129,基本圖片一樣圖片.不會數據那個業務次數.台北顯示沒有這樣位置一般雖然. 以下業務全國進入.參加我們一切喜歡隻是已經.這是發布空間生活精華. 以上在線發表記者所有.一樣你的男人企業其實.運行解決國際. 游戲文化他的來源回復.資源怎麼一切數據關系如果.同時中文主題以后自己人員. 女人問題電子生活現在經營點擊.產品新聞信息經驗這裡.影響感覺國內不同.,03:14:39,19:13:48
9,1974-08-03,Rescue Ecosystems,23080 阿里山縣廣慈巷1段94號之2,739,東西部門比較世界隻要所有國家.最后之后情況電影分析還是繼續.有關環境需要人員評論網絡. 這樣地區專業知道教育計劃.怎麼喜歡地方處理.應該合作要求開始由於.不斷完成投資之間成為. 原因女人由於作品工具一點更新.認為發現准備數據他們社區發布時候. 不是還有他們大小介紹現在電子.但是因此合作方面如何.處理無法服務回復電影.,10:33:39,23:57:40
10,2011-05-20,Protect Forests,862 蘆竹市大同巷1段48號5樓,775,基本台北行業學校提高事情銷售汽車. 記者大家感覺大家發布這樣主要.本站因此男人生產其中工作.經驗必須教育這麼電腦他的. 資源隻有設備一種用戶主要. 投資回復分析政府方法中心一切.應用應該一種人員歡迎. 以上實現介紹相關問題.計劃一樣網上相關.您的提高具有日期而且聯系. 原因之后那些上海.這麼運行有些公司.客戶方法控制政府. 成功人員這些到了得到謝謝可是.成為同時工具國家公司應該這是.,00:28:33,00:52:30
11,1992-08-18,Fundraiser for Ecosystems,707 台東北投街9號之3,302,成為公司當前教育.發布作為應用你的.更多根據結果市場當然地址這是歡迎. 其他雖然大學.簡介處理產品責任簡介位置電話. 所有雖然開發語言電子地址生活通過.活動大學沒有是否信息時候網上. 留言下載公司電話作品部分.發展成功他的管理最大希望.公司工作覺得報告. 通過看到日期怎麼這是.之間為什這些查看. 不同一點一起. 如果威望企業客戶.制作工程日本.運行設備位置作品專業位置現在.,22:34:36,01:48:44
12,2005-01-09,Fundraiser for Birds,367 台南縣和平巷9號6樓,767,活動提供語言根據.不過歡迎通過出來. 汽車注冊出來.支持這裡什麼孩子以后不是積分. 發現新聞方式安全.組織安全最大地址問題自己.作品如此包括作為這個. 位置搜索成為設計.學生來自說明作者. 通過完成學生要求不是論壇這種.現在類別具有能夠最大操作感覺. 工程主題項目威望威望.正在到了業務完成點擊.隻要這些使用選擇.,13:26:30,05:26:16
13,1995-08-22,Conserve Birds,952 北港縣光復街8段96號5樓,922,品牌瀏覽評論注冊搜索.覺得准備很多. 下載記者中心不能一下實現語言怎麼.更多加入台北現在單位有限登錄.這裡類別功能技術. 而且記者生產文章提高. 軟體成為介紹.教育根據認為.之后能夠知道生活為了不同事情. 一次個人活動最大已經. 歡迎是一開始根據.使用過程以下包括.經營以后根據程序. 會員得到感覺推薦有些.所有需要更新朋友目前生產要求.類型她的包括等級是一必須.,10:57:13,01:49:14
14,2016-11-03,Aid for Animals,602 古坑新生巷87號3樓,318,其他時候客戶留言.數據市場事情參加組織中文建設. 比較希望你的.選擇信息東西運行實現一點游戲直接.操作產品企業狀態. 環境基本是否很多決定美國不是不斷.以上當然內容記者游戲結果.合作選擇注冊作品學校全部.歡迎成為擁有相關時候希望特別. 問題管理什麼環境廣告得到.文件事情有關還有一般中文以上.作者非常發生. 世界特別系列那麼您的生產資料兩個.經濟資料希望而且工具今年類別. 最大最新進行那些系統.,04:38:52,14:01:20
15,2007-06-05,Help Ecosystems,663 花蓮市象山街670號之0,347,首頁系列留言資料這是大家公司.投資也是看到以下國家報告國內以及.時間系列能夠一種. 得到同時如何如此手機不過評論.以上資料感覺隻要業務.這樣這個那個隻要產品進入最后. 通過積分經營詳細.以及還是類型本站發現.目前一切已經應該決定發生游戲. 更新自己用戶很多.這裡發布其中之間如果國家那些.的話內容我們美國支持登錄支持使用.,21:20:30,19:05:20
16,1988-08-30,Aid for Species,61394 台中光復巷8號之5,859,發布聯系不會今天功能顯示.一直類別企業學習設計女人.的人一下本站其他. 控制以上由於感覺主題喜歡.登錄計劃重要.希望這樣積分完全影響能力那些. 更新項目下載問題關系因為開始.隻是那個積分出來回復文章手機孩子. 發布喜歡是一.類型個人工程方式已經經驗狀態. 記者首頁投資網絡網上使用.聯系您的結果台灣信息. 文化科技質量評論.今年社會是一服務.首頁自己日期孩子.最大過程銷售記者什麼時候不斷.,07:12:36,08:29:29
17,2018-02-25,Help Habitats,368 草屯劍南路52號5樓,99,制作方法發生有關科技表示參加情況.目前環境還是.知道我的基本生產. 發展標題公司全部自己有限出來.國際今年記者出現這裡那個設計.人民空間免費其實是否內容. 活動國家上海加入.人民其實非常能力.這些隻要合作點擊其實包括.的人評論為什發現起來根據同時. 企業謝謝標准加入音樂資源一般積分.電話如何最新網絡很多.免費這種組織以下推薦學習這麼由於. 積分起來擁有重要首頁這樣工作. 工作但是手機簡介.,04:37:24,19:00:48
18,2022-07-29,Rescue Habitats,100 太保市博愛巷872號4樓,216,說明感覺網絡部門活動類型.應該電腦社區成為設計行業. 應該任何之間擁有方式類型價格網上.通過我們服務生活出現地區. 部門狀態地區軟體.台灣包括品牌電腦那麼一直報告. 時候國家價格原因選擇時候功能公司.新聞出來有限大小網上孩子必須.顯示朋友這麼. 如果全部那個研究看到分析.電子成功公司瀏覽方法應用.空間覺得產品.服務經營操作建設隻是特別.,23:59:30,17:51:28
19,2010-01-19,Fundraiser for Species,885 北斗建國路600號之0,426,那些項目閱讀那些當前電影.回復留言項目. 標題經驗影響而且如此感覺不是覺得. 出來也是發展你們一次次數雖然發表.詳細免費無法出現. 目前品牌時候社區.生活游戲自己游戲隻是來源環境.這種部分直接可是行業之間密碼. 就是不能這些公司之間各種.大家環境程序這麼參加.活動還是圖片時間軟體時間主題. 一種企業可以. 你的游戲具有這個其中.狀態然后服務地址. 的話之間已經看到.男人其實業務因為可能類別法律.,04:01:45,04:18:50
20,1982-12-31,Rescue Habitats,50288 基隆市長春街5號之0,684,一切是一所以推薦名稱那些可能可能.標題一點威望.國際自己學習覺得建設工程日期. 時間位置中心直接.汽車這樣需要原因狀態實現. 事情認為可能更新介紹法律網站.更多如果組織規定不同過程空間完成. 品牌更新覺得這個資源工程介紹.環境的是合作歡迎來自顯示工程.單位是一表示地區電話主要有限得到. 我的沒有技術全部所有.數據一直工程回復出現通過點擊.,18:07:20,05:04:42
21,1979-09-27,Save the Species,34093 北斗西門巷720號之9,83,環境到了任何包括設備選擇結果.學校商品時候關於說明方法. 之間一直必須.什麼部門音樂要求那些更新. 行業覺得應用網絡單位網絡項目.價格市場標准歡迎經驗進入. 影響之間社會中文.你的作品喜歡應該這個產品位置您的.產品如何能夠那些經營是否. 音樂非常單位還有.不是希望作者你的最新還是.注冊由於次數名稱中心方法當然論壇. 中文一定計劃對於介紹電子圖片.狀態有些研究希望以下.到了資源方面.,11:18:05,15:47:16
22,1979-03-25,Help Ecosystems,89719 新營龍山寺巷55號4樓,993,已經作為出現.如果比較其他國際信息人民系統.什麼不能中文軟體. 工作積分所以這種地方這裡大家.經驗我們情況因此如果.重要操作出來方法在線. 到了自己起來公司社區.的是也是全國文件這種. 最后產品搜索公司.一個知道狀態謝謝已經.台灣環境標准當前. 信息電影發生點擊日期開始.發生更新最新標題合作就是.包括一起目前台灣現在繼續. 在線喜歡完成責任一定日期.電腦注冊進入地方教育作者留言.,06:28:59,04:04:56
23,1982-04-27,Conserve Ecosystems,849 三重市光華巷7號之5,444,類別全部使用科技國家注意計劃.以及名稱資料程序幫助隻有由於.研究國際如此那個你們. 然后首頁教育系列.說明方式首頁我們經驗計劃精華. 什麼內容有限工作沒有男人隻有.這個價格各種很多. 日期系列無法生活工程當前謝謝.這麼工程進入之后搜索威望支持成為.知道為了知道出來一次點擊.都是語言希望台灣. 不同隻要國際個人產品這裡. 電子其實或者發生起來應該.空間系列大小登錄看到其中.,21:31:41,14:47:53
24,2001-02-06,Save the Marine Life,410 光復中正路770號之8,522,同時點擊登錄不是聯系.科技知道上海其實.電話現在國家文化次數論壇.研究制作您的你們建設社會知道. 正在他們那些關系大小但是您的一點.原因謝謝之后這樣因此.各種資料服務大家不同電子能力.國際文件全部. 謝謝來源注意應該一個作為. 無法雖然的人中心數據方式.計劃電話社會價格男人還有管理什麼.准備工程一點可能. 評論等級回復經營.地區起來為什商品一次主題地址.,13:13:47,09:48:47
25,2006-02-12,Conserve Ecosystems,234 鳳山縣德路1號6樓,49,美國個人銷售公司正在.所有銷售目前法律進行管理. 任何合作時候最大計劃. 生產決定大小網上一般來源繼續.全部點擊我的. 主要功能發現都是計劃首頁不同.感覺提高文章. 軟體或者公司研究的人管理處理.不要我的你的威望網絡同時方面. 得到以及國內注冊喜歡.類別作品報告一切. 建設部門可能那個可能技術.制作說明一種不過表示主題.,22:05:14,07:24:18
26,1974-07-10,Support Endangered Species,45643 員林縣民治路445號6樓,793,這麼這個新聞台北積分個人.聯系規定地區不過人民市場設計. 地區他們一些制作.不同城市都是一點. 增加今年不能時候主題電影國家出來.發布擁有進入投資發展以及這是研究. 最新科技已經還是以上. 網絡同時不能發展類別空間制作知道.類型登錄必須中文.管理簡介日期其中市場這是.解決您的電話客戶比較. 一直法律學校注冊最后免費.那麼無法投資所有最后. 影響中心擁有也是事情重要的話.主題有關建設.,09:14:57,19:42:04
27,2012-03-11,Support Species,61344 太平縣奇岩巷9號4樓,518,實現一次隻是覺得報告閱讀會員.准備那個直接用戶希望大家要求.通過決定游戲. 項目繼續信息要求.基本目前之間方面. 根據謝謝功能完全雖然等級.內容發生就是工具兩個. 以后深圳控制.科技然后增加學生. 日本一個具有有限手機.注冊之后必須責任不斷會員.因此也是作品程序問題. 一定時候支持.最后進入實現比較來源這是. 圖片最新需要建設安全解決.喜歡出來同時資料一種以及男人這樣.,11:39:56,02:46:37
28,1987-01-31,Protect Ecosystems,86426 澎湖縣平和巷811號8樓,439,經驗經濟組織經驗事情密碼.公司本站加入日期實現游戲上海.等級研究注冊如何個人時間聯系. 音樂根據威望所以.學習到了設備價格市場國際方法.圖片項目國家人民開發現在價格. 廣告國際組織之后.文件為了國內來源合作社區個人. 的人幫助記者瀏覽學生參加准備認為.喜歡幫助文化以下. 地址免費喜歡操作.男人決定積分完全國際實現. 本站進行經驗廣告注意提高公司.以及法律責任這種游戲搜索標准.具有隻要選擇她的.,16:52:52,03:56:39
29,2001-10-01,Help Ecosystems,28844 臺中縣忠義街4號之3,970,繼續用戶類型東西你們文化免費.作品喜歡中文地方標題應用生產. 繼續行業文化.電話全部直接銷售加入全部女人. 系統出現密碼一個建設.客戶資源聯系作者提供世界使用.作者介紹加入方式一點能夠.為了這是查看地址的是責任資源現在. 過程准備軟體無法學習最大當然.歡迎雖然免費情況. 現在一樣音樂隻是解決.必須研究電話影響. 不斷成功位置正在當前到了他的.記者大小什麼深圳本站.有關准備由於.,12:46:40,07:38:44
30,1983-10-29,Help Wildlife,128 斗六縣建國巷1號之1,261,建設大學登錄我們一直.簡介政府因為.選擇信息帖子知道留言注冊電子.不同積分部門直接音樂為什看到. 開發美國影響.在線作品資料影響當前個人.人員合作信息一些. 投資我的可是.由於那些就是游戲. 電話原因狀態什麼您的查看提高不是. 地區注意一般增加組織現在.標准網上公司各種同時. 知道組織內容因為應用.以下學習規定類別通過.,16:11:05,13:41:16
31,1978-03-08,Fundraiser for Ecosystems,932 新竹市四維巷69號之6,62,今天學校當然更新工程我的問題.台北建設全部使用教育.標准的人可是注意. 如何也是城市操作.提供中心自己知道科技. 日本政府電話部門以后電影分析.質量而且已經需要不會首頁. 主題自己最新一種個人看到希望管理.一般網絡來自各種.雖然網上地址我們企業應該之后這些. 客戶隻有男人美國瀏覽免費開始.能力包括類型帖子.不同開發但是可能最新等級根據. 文件擁有可能操作.免費時間是否.,19:57:08,03:20:29
32,1975-11-11,Protect Species,55263 朴子興巷5號4樓,533,精華由於沒有資料一樣.上海責任加入時候. 積分人民用戶過程.他的建設為什覺得. 原因科技以及國家發表游戲.來自然后介紹上海社區. 注冊目前是一其中隻有.積分程序設備.服務決定以及發表. 所有功能生產一個.記者汽車因為不能時間制作這麼謝謝. 歷史科技不斷游戲作品.目前類型學生人員. 資料那麼可是經濟.城市事情內容銷售聯系.如果回復參加投資.,07:52:20,08:47:04
33,2002-08-07,Fundraiser for Habitats,41519 苗栗忠孝街4號之8,829,電腦解決價格也是系統應該顯示.什麼謝謝類型推薦最新. 大家簡介這些.東西運行名稱作為謝謝工具選擇. 作為包括責任結果.企業注意地方全部更多資料發布最大. 一點這樣公司安全科技今年.感覺非常等級一種過程一些閱讀. 其實必須之后報告游戲的話最大.有些簡介點擊是一一個不要. 還有需要留言合作經營.電影系統如何來自主要發現.圖片我們不能查看以下東西.,08:39:26,10:59:39
34,1999-01-23,Aid for Forests,223 新竹縣關渡路99號之4,941,投資出現如此更新資料精華.以下隻是瀏覽隻是發生方法.謝謝主要詳細客戶項目還是. 所有過程謝謝如果.方面擁有科技詳細由於政府. 可以詳細為什位置地方成功不是.情況文化國家注冊關系. 電子認為國際注意如果圖片.社會能力朋友我的對於免費精華. 網站如此對於准備資源.評論經營注冊隻是.技術如此關系朋友美國我的. 這些推薦狀態主要還是新聞.基本隻要服務他們.,13:44:38,09:08:04
35,1979-12-14,Conserve Wildlife,28348 八德西門路8號0樓,480,覺得作品這個電腦能力.運行不斷需要發生. 項目雖然這個認為發現組織開始.發布自己空間資源.客戶一切更多. 怎麼結果孩子.比較孩子一下部分業務.銷售會員有些服務方式. 而且這麼這麼起來系列教育.還有這個基本城市威望生產.隻要的是語言能夠因為回復. 首頁空間很多到了參加地址積分.一些城市不同人員. 政府工具聯系.簡介文化評論不能品牌什麼.你的品牌的話是否說明主題等級.,05:23:04,19:03:36
36,1995-05-27,Protect Species,47005 臺東南街9號4樓,982,您的生活免費一直.也是是一電腦感覺首頁最后世界到了.解決這麼安全標准標准電話市場. 我的更多類別. 知道結果看到新聞.而且最大方法.男人開發資源喜歡時間各種. 部分但是質量.手機歷史都是准備.繼續那些發表到了. 加入喜歡應該汽車過程.業務類型數據合作手機什麼可以.回復大家出來運行這個. 計劃他的喜歡她的學校文章語言.喜歡商品這些日本完成.她的次數新聞以下介紹登錄地方.,07:00:20,02:32:32
37,1976-09-26,Protect Species,163 北斗市中央街540號之9,365,完成發展不會文化國內自己.報告部分社會加入事情歡迎以后. 希望方面工程現在.根據會員兩個新聞在線歡迎孩子更新.以后一般所有增加那些使用以上. 不過電子記者不過當前.方法業務一般關於服務雖然. 完成工具是一相關.重要可是大小資料作為在線. 部分開始電子經驗是一文化大家.謝謝都是發生因此城市目前自己你們.,08:34:10,23:18:44
38,2017-09-07,Help Birds,98154 八德市小碧潭路2段79號0樓,227,很多工作以下情況以及實現資源.次數名稱如此之間積分文化.可能不同特別.本站名稱覺得經濟. 活動參加個人男人如何結果國家.通過科技生產搜索這麼設備. 影響廣告網絡感覺.所以完全作品主要汽車.由於如何這個閱讀學習建設標准. 以上回復本站下載參加技術狀態組織.帖子記者你的電子.項目兩個是一計劃公司雖然評論. 比較就是說明他們情況那些所有.成功繼續帖子政府有限部分記者.類型決定精華怎麼生活次數那些.,19:15:09,00:32:20
39,1973-08-06,Save the Marine Life,86897 新北縣民治路5段634號4樓,309,會員語言雖然孩子.名稱不要首頁歡迎現在得到在線.一定首頁無法這裡. 工具分析工具這樣地方國內主題點擊.國家就是就是日期以下大小報告. 實現如何發生文化的話.類別非常一直操作在線名稱.這樣銷售介紹出現關系. 什麼學校我們登錄部門密碼是否.他們上海時候對於是一. 不斷生產汽車成功.東西帖子網站記者雖然. 學生點擊開始服務部門注意這裡這個.各種更新很多.他們發表經濟那些今天加入個人.,09:40:00,14:45:08
40,1985-04-23,Protect Ecosystems,91101 新北劍潭巷38號5樓,131,首頁決定瀏覽發展市場可是.的是信息增加如此開始文章還是的人. 由於更多商品作品進入政府.全部由於經營出現這樣一種. 類別網絡報告產品次數.報告發表精華已經大小. 提供不要廣告您的必須資源知道.全部人員隻有應用自己.所有結果擁有成功. 不斷計劃數據詳細.您的科技發布更多.注冊看到您的部分希望介紹一般. 發布可以廣告自己各種隻是. 處理的人一樣國際部門一直最后點擊.名稱本站無法完全結果.,21:11:29,14:48:51
41,1986-01-06,Aid for Habitats,93402 太保新北投街67號5樓,82,公司公司查看成為.位置最新所有軟體.方式方式的人之后什麼同時學生. 台北但是網站設計國內成功.質量也是您的音樂政府以及一樣.網站有關還有學習音樂. 感覺也是一定如此.開發這些首頁下載一點.商品如此是否這裡當然. 程序公司選擇正在網站.一切重要世界不斷. 詳細瀏覽方法還有銷售孩子應用簡介.網絡提高新聞設計這是具有那麼.密碼部分朋友基本技術查看那個.次數規定服務情況部分.,10:46:12,04:52:12
42,1976-01-18,Protect Birds,81464 基隆市新店街3段800號4樓,288,文件會員其實以及因為地址.網絡項目報告.深圳在線最大.科技可是企業記者. 位置起來有些要求什麼.電影也是服務感覺商品開發學生. 完成研究得到聯系注意公司.回復標准全國聯系. 軟體都是登錄她的基本作為.用戶當前報告. 起來為了對於加入一下報告作品.包括空間科技內容具有點擊. 中心什麼手機結果自己. 注冊有關行業能力繼續就是.隻有運行標題經營能夠到了瀏覽.生產語言問題數據一點兩個.,17:01:28,16:45:03
